{
  "$schema": "https://json-schema.org/draft/2020-12/schema",
  "title": "C~ project",
  "type": "object",
  "additionalProperties": false,
  "required": [
    "sources"
  ],
  "properties": {
    "kind": {
      "type": "string",
      "enum": ["application", "standard-library"],
      "default": "application",
      "description": "Project behavior. Standard-library projects validate physical library sources and do not produce an executable."
    },
    "target": {
      "type": "string",
      "enum": [
        "hosted",
        "esp-idf",
        "esp32_qemu",
        "esp32c3_qemu",
        "freestanding",
        "cosmopolitan"
      ],
      "default": "hosted",
      "description": "Compiler target and target-specific standard library."
    },
    "architecture": {
      "type": "string",
      "enum": ["auto", "x86", "x64", "arm32", "arm64", "xtensa", "riscv32", "riscv64"],
      "default": "auto",
      "description": "Compilation architecture used by compile-time target queries and target-specific intrinsics."
    },
    "cpuFeatures": {
      "type": "array",
      "uniqueItems": true,
      "items": { "type": "string", "enum": ["simd128"] },
      "description": "Explicit CPU features. SIMD remains scalar unless simd128 is selected."
    },
    "simdOptimizations": {
      "type": "boolean",
      "default": false,
      "description": "Enable hosted x64 SIMD optimization of scalar vectors, matrices, quaternions, and packet geometry. This implicitly selects simd128."
    },
    "modules": {
      "type": "array",
      "description": "Exact repository-backed source modules. Build and check never access the network.",
      "items": {
        "type": "object",
        "additionalProperties": false,
        "required": ["path", "repository", "selector"],
        "properties": {
          "path": { "type": "string", "minLength": 1 },
          "repository": { "type": "string", "minLength": 1 },
          "selector": { "type": "string", "minLength": 1, "description": "Commit, tag, or branch resolved to an exact lock revision." },
          "alias": { "type": "string", "pattern": "^[A-Za-z_][A-Za-z0-9_]*$" },
          "sources": {
            "type": "array", "minItems": 1, "uniqueItems": true,
            "items": { "type": "string", "minLength": 1 },
            "default": ["**/*.ct"]
          },
          "vendor": { "type": "string", "minLength": 1, "description": "Project-relative verified vendor directory." },
          "updatePolicy": { "type": "string", "enum": ["locked", "refresh"], "default": "locked" }
        }
      }
    },
    "noRecursion": {
      "type": "boolean",
      "default": false,
      "description": "Reject recursion and calls whose possible targets cannot be closed statically in every reachable method."
    },
    "panicPolicy": {
      "type": "string",
      "enum": ["abort", "restart", "halt"],
      "default": "abort",
      "description": "ESP-IDF fatal-panic terminal policy. The halt policy requires CONFIG_ESP_SYSTEM_PANIC_PRINT_HALT=y."
    },
    "sources": {
      "type": "array",
      "minItems": 1,
      "uniqueItems": true,
      "items": {
        "type": "string",
        "minLength": 1
      },
      "description": "Source globs relative to this manifest."
    },
    "exclude": {
      "type": "array",
      "uniqueItems": true,
      "items": {
        "type": "string",
        "minLength": 1
      },
      "description": "Source globs removed after the sources patterns are evaluated."
    },
    "hosted": {
      "type": "object",
      "additionalProperties": false,
      "description": "Hosted-only native inputs and runtime assets.",
      "properties": {
        "nativeSources": {
          "type": "array",
          "uniqueItems": true,
          "items": { "type": "string", "pattern": "\\.c$" }
        },
        "runtimeFiles": {
          "type": "array",
          "description": "Platform-specific runtime files staged beside the hosted executable after a successful native link.",
          "items": {
            "type": "object",
            "additionalProperties": false,
            "required": ["os", "architecture", "source", "output"],
            "properties": {
              "os": { "type": "string", "enum": ["windows", "linux"] },
              "architecture": { "type": "string", "enum": ["x86", "x64", "arm32", "arm64", "riscv32", "riscv64"] },
              "source": { "type": "string", "minLength": 1, "description": "Explicit file path relative to the project manifest; globs and directories are not accepted." },
              "output": { "type": "string", "minLength": 1, "pattern": "^[^/\\\\]+$", "description": "Destination file name beside the executable." }
            }
          }
        }
      }
    },
    "espIdf": {
      "type": "object",
      "additionalProperties": false,
      "description": "ESP-IDF-specific project inputs.",
      "properties": {
        "artifact": {
          "type": "string",
          "enum": ["firmware", "managed-module"],
          "default": "firmware",
          "description": "Build ordinary firmware or an ABI 1 managed ELF module."
        },
        "bindings": {
          "type": "array",
          "minItems": 1,
          "uniqueItems": true,
          "items": { "type": "string", "minLength": 1 },
          "description": "Project-relative ESP-IDF binding manifest paths."
        }
      }
    },
    "managedModule": {
      "type": "object",
      "additionalProperties": false,
      "required": ["kind", "name", "version"],
      "properties": {
        "kind": { "type": "string", "enum": ["application", "library"] },
        "name": { "type": "string", "pattern": "^[A-Za-z][A-Za-z0-9]*(\\.[A-Za-z][A-Za-z0-9]*)*$" },
        "version": { "type": "string", "pattern": "^(0|[1-9][0-9]*)(\\.(0|[1-9][0-9]*)){2}(-[0-9A-Za-z.-]+)?(\\+[0-9A-Za-z.-]+)?$" },
        "references": {
          "type": "array", "uniqueItems": true,
          "items": { "type": "string", "pattern": "\\.ctmeta\\.json$" },
          "default": [],
          "description": "Exact project-relative compiled metadata references; referenced source is not added to this compilation."
        },
        "mainTaskStackBytes": { "type": "integer", "minimum": 2048, "multipleOf": 16, "default": 8192 },
        "heapLimitBytes": { "type": "integer", "minimum": 0, "description": "Per-process heap quota in bytes; zero or omission means unlimited." }
      }
    },
    "freestanding": {
      "type": "object",
      "additionalProperties": false,
      "description": "GNU/ELF freestanding linker and native inputs.",
      "properties": {
        "linkerScript": { "type": "string", "minLength": 1 },
        "entrySymbol": { "type": "string", "pattern": "^[A-Za-z_$][A-Za-z0-9_$]*$" },
        "nativeSources": {
          "type": "array", "uniqueItems": true,
          "items": { "type": "string", "pattern": "\\.(c|s|S)$" }
        },
        "objectFiles": {
          "type": "array", "uniqueItems": true,
          "items": { "type": "string", "pattern": "\\.o$" }
        },
        "libraries": {
          "type": "array", "uniqueItems": true,
          "items": { "type": "string", "pattern": "\\.a$" }
        },
        "compileOptions": { "type": "array", "items": { "type": "string", "minLength": 1 } },
        "linkOptions": { "type": "array", "items": { "type": "string", "minLength": 1 } }
      }
    },
    "cosmopolitan": {
      "type": "object",
      "additionalProperties": false,
      "description": "Cosmopolitan Libc runtime selection for x86-64 APE builds.",
      "properties": {
        "mode": {
          "type": "string",
          "enum": ["default", "tiny", "debug"],
          "default": "default"
        }
      }
    },
    "build": {
      "type": "object",
      "additionalProperties": false,
      "description": "Optional generated-output and native-build settings.",
      "properties": {
        "generatedC": {
          "type": "string",
          "minLength": 1,
          "description": "Generated C path relative to the project directory."
        },
        "generatedHeader": {
          "type": "string",
          "minLength": 1,
          "description": "Generated native header path relative to the project directory."
        },
        "cLayout": {
          "type": "string",
          "enum": ["unity", "modules"],
          "default": "unity",
          "description": "Generated C layout. Modular output partitions reachable definitions by stable source identity after whole-program optimization."
        },
        "generatedDirectory": {
          "type": "string",
          "minLength": 1,
          "description": "Generated modular bundle directory relative to the project directory."
        },
        "symbolMap": {
          "type": "string",
          "minLength": 1,
          "description": "Optional generated JSON symbol-map path relative to the project directory."
        },
        "stackReport": {
          "type": "string",
          "minLength": 1,
          "description": "Optional schema-v1 static native stack report path. Requires a GCC-family native build."
        },
        "lto": {
          "type": "boolean",
          "default": false,
          "description": "Enable hosted or Cosmopolitan link-time optimization. Requires Release configuration."
        },
        "configuration": {
          "type": "string",
          "enum": ["debug", "release"],
          "default": "debug",
          "description": "Hosted or Cosmopolitan native build configuration."
        },
        "optimization": {
          "type": "string",
          "enum": ["speed", "aggressive"],
          "description": "Controlled Release optimization: /O2 (plus /Ob3 for aggressive) or -O2/-O3. Omit to preserve the target's legacy behavior."
        },
        "cpuTarget": {
          "type": "string",
          "enum": ["baseline", "avx2"],
          "description": "Controlled native CPU target. AVX2 requires resolved x64 and does not add runtime dispatch."
        },
        "floatingPoint": {
          "type": "string",
          "enum": ["precise", "fast"],
          "description": "Explicit floating-point policy. Fast permits reassociation and contraction and need not match precise output hashes."
        },
        "pgo": {
          "type": "object",
          "additionalProperties": false,
          "description": "Hosted-only profile-guided optimization phase and project-contained profile root.",
          "properties": {
            "mode": {
              "type": "string",
              "enum": ["off", "generate", "use"],
              "default": "off"
            },
            "directory": {
              "type": "string",
              "minLength": 1,
              "default": "build/pgo"
            }
          }
        },
        "compiler": {
          "type": "string",
          "minLength": 1,
          "default": "auto",
          "description": "Hosted compiler, or the x86_64-unknown-cosmo-cc wrapper for Cosmopolitan projects."
        },
        "executable": {
          "type": "string",
          "minLength": 1,
          "description": "Hosted executable or Cosmopolitan APE path relative to the project directory."
        },
        "image": {
          "type": "string",
          "minLength": 1,
          "description": "Freestanding ELF image path relative to the project directory."
        },
        "espIdfProjectDirectory": {
          "type": "string",
          "minLength": 1,
          "default": ".",
          "description": "ESP-IDF project directory relative to the C~ project directory."
        }
      }
    },
    "run": {
      "type": "object",
      "additionalProperties": false,
      "description": "Optional rebuild-and-run process settings used by ctilde --run and the VS Code Run Project command.",
      "properties": {
        "executor": {
          "type": "string",
          "enum": ["host", "wsl"],
          "default": "host",
          "description": "Run directly on the host or through wsl --exec. WSL execution is available only from Windows."
        },
        "command": {
          "type": "string",
          "minLength": 1,
          "description": "PATH command or project-relative executable. Hosted and Cosmopolitan projects default to their built output."
        },
        "args": {
          "type": "array",
          "items": { "type": "string" },
          "default": [],
          "description": "Arguments passed without shell parsing. Supports ${projectRoot} and ${buildOutput}."
        },
        "workingDirectory": {
          "type": "string",
          "minLength": 1,
          "default": ".",
          "description": "Project-contained working directory. Supports ${projectRoot} and ${buildOutput}."
        },
        "environment": {
          "type": "object",
          "propertyNames": { "pattern": "^[A-Za-z_][A-Za-z0-9_]*$" },
          "additionalProperties": { "type": "string" },
          "default": {},
          "description": "Environment overrides. Values support ${projectRoot} and ${buildOutput}."
        },
        "successExitCodes": {
          "type": "array",
          "minItems": 1,
          "uniqueItems": true,
          "items": { "type": "integer" },
          "default": [0],
          "description": "Process exit codes treated as a successful run."
        }
      }
    }
  },
  "allOf": [
    {
      "if": {
        "properties": { "target": { "const": "esp32_qemu" } },
        "required": ["target"]
      },
      "then": {
        "properties": { "architecture": { "const": "xtensa" } }
      }
    },
    {
      "if": {
        "properties": { "target": { "const": "esp32c3_qemu" } },
        "required": ["target"]
      },
      "then": {
        "properties": { "architecture": { "const": "riscv32" } }
      }
    },
    {
      "if": {
        "properties": { "kind": { "const": "standard-library" } },
        "required": ["kind"]
      },
      "then": {
        "not": {
          "anyOf": [
            { "required": ["target"] },
            { "required": ["architecture"] },
            { "required": ["cpuFeatures"] },
            { "required": ["simdOptimizations"] },
            { "required": ["modules"] },
            { "required": ["noRecursion"] },
            { "required": ["panicPolicy"] },
            { "required": ["build"] },
            { "required": ["run"] },
            { "required": ["hosted"] },
            { "required": ["espIdf"] },
            { "required": ["managedModule"] },
            { "required": ["freestanding"] },
            { "required": ["cosmopolitan"] }
          ]
        }
      }
    },
    {
      "if": {
        "properties": {
          "espIdf": {
            "properties": { "artifact": { "const": "managed-module" } },
            "required": ["artifact"]
          }
        },
        "required": ["espIdf"]
      },
      "then": {
        "required": ["managedModule"],
        "properties": {
          "target": { "enum": ["esp-idf", "esp32_qemu", "esp32c3_qemu"] },
          "build": {
            "properties": { "cLayout": { "const": "modules" } }
          }
        }
      }
    },
    {
      "if": {
        "properties": { "simdOptimizations": { "const": true } },
        "required": ["simdOptimizations"]
      },
      "then": {
        "properties": {
          "target": { "const": "hosted" },
          "architecture": { "enum": ["auto", "x64"] }
        }
      }
    }
  ]
}
