{
  "target": "hosted",
  "architecture": "x64",
  "sources": ["Program.ct"],
  "build": {
    "configuration": "release",
    "cLayout": "modules",
    "generatedDirectory": "build/generated/modules",
    "generatedHeader": "build/generated/ctilde_exports.h",
    "symbolMap": "build/generated/ctilde_symbols.json",
    "executable": "build/CollectionsAndGeometry.exe"
  }
}
