{
  "target": "hosted",
  "architecture": "x64",
  "simdOptimizations": true,
  "sources": ["*.ct"],
  "build": {
    "cLayout": "modules",
    "generatedDirectory": "build/generated/modules",
    "generatedHeader": "build/generated/ctilde_exports.h",
    "symbolMap": "build/generated/ctilde_symbols.json",
    "configuration": "release",
    "lto": false
  }
}
